{
  "request_id": "eeeeeeee-ffff-4aaa-8bbb-000000000001",
  "nome": "Patricia Ramos",
  "email": "patricia.ramos@example.com",
  "telefone": "(00) 90000-0201",
  "interesse": "Sofa retiltil",
  "mensagem": "Quero medidas para sala pequena.",
  "utm_source": "instagram",
  "utm_medium": "social",
  "utm_campaign": "primavera-2026",
  "utm_term": "sofa-3-lugares",
  "utm_content": "carrossel-01",
  "consentimento_lgpd": true
}
